stainless-steel-suppliers-alappuzha/index.html,/stainless-steel-suppliers-alappuzha/,city,Stainless Steel Suppliers in Alappuzha | Bharat Metals,Stainless Steel Suppliers in Alappuzha,"Stainless steel suppliers for Alappuzha. Bharat Metals Chennai supports enquiries for Pipes, Sheets, Plates, Fasteners, Fittings and grades such as SS 304, SS 316, SS 316L.",891,6,real image,yes,no,no,no,yes,yes,0,
stainless-steel-suppliers-ambattur/index.html,/stainless-steel-suppliers-ambattur/,city,Stainless Steel Suppliers in Ambattur | Bharat Metals,Stainless Steel Suppliers in Ambattur,"Stainless steel suppliers for Ambattur. Bharat Metals Chennai supports enquiries for Rods, Bars, Flats, Sheets, Pipes and grades such as SS 304, SS 316, SS 202.",900,6,real image,yes,yes,no,no,yes,yes,0,
stainless-steel-suppliers-anantapur/index.html,/stainless-steel-suppliers-anantapur/,city,Stainless Steel Suppliers in Anantapur | Bharat Metals,Stainless Steel Suppliers in Anantapur,"Stainless steel suppliers for Anantapur. Bharat Metals Chennai supports enquiries for Pipes, Sheets, Plates, Rods, Bars and grades such as SS 304, SS 316, SS 202.",895,6,real image,yes,no,no,no,yes,yes,0,
stainless-steel-suppliers-andaman-and-nicobar-islands/index.html,/stainless-steel-suppliers-andaman-and-nicobar-islands/,city,Stainless Steel Suppliers in Andaman and Nicobar Islands | Bharat Metals,Stainless Steel Suppliers in Andaman and Nicobar Islands,"Stainless steel suppliers for Andaman and Nicobar Islands. Bharat Metals Chennai supports enquiries for Pipes, Sheets, Plates, Rods, Bars and grades such as SS 304, SS 316, SS 202.",993,6,real image,yes,yes,no,no,yes,yes,0,
stainless-steel-suppliers-arakkonam/index.html,/stainless-steel-suppliers-arakkonam/,city,Stainless Steel Suppliers in Arakkonam | Bharat Metals,Stainless Steel Suppliers in Arakkonam,"Stainless steel suppliers for Arakkonam. Bharat Metals Chennai supports enquiries for Pipes, Sheets, Plates, Rods, Bars and grades such as SS 304, SS 316, SS 202.",902,6,real image,yes,no,no,no,yes,yes,0,
stainless-steel-suppliers-arcot/index.html,/stainless-steel-suppliers-arcot/,city,Stainless Steel Suppliers in Arcot | Bharat Metals,Stainless Steel Suppliers in Arcot,"Stainless steel suppliers for Arcot. Bharat Metals Chennai supports enquiries for Pipes, Sheets, Plates, Rods, Bars and grades such as SS 304, SS 316, SS 202.",902,6,real image,yes,no,no,no,yes,yes,0,
stainless-steel-suppliers-ariyalur/index.html,/stainless-steel-suppliers-ariyalur/,city,Stainless Steel Suppliers in Ariyalur | Bharat Metals,Stainless Steel Suppliers in Ariyalur,"Stainless steel suppliers for Ariyalur. Bharat Metals Chennai supports enquiries for Pipes, Sheets, Plates, Rods, Bars and grades such as SS 304, SS 316, SS 202.",902,6,real image,yes,no,no,no,yes,yes,0,
stainless-steel-suppliers-armenian-street-chennai/index.html,/stainless-steel-suppliers-armenian-street-chennai/,city,Stainless Steel Suppliers in Armenian Street Chennai | Bharat Metals,Stainless Steel Suppliers in Armenian Street Chennai,"Stainless steel suppliers for Armenian Street Chennai. Bharat Metals Chennai supports enquiries for Pipes, Sheets, Plates, Rods, Bars and grades such as SS 304, SS 316, SS 202.",964,6,real image,yes,no,no,no,yes,yes,0,
stainless-steel-suppliers-avadi/index.html,/stainless-steel-suppliers-avadi/,city,Stainless Steel Suppliers in Avadi | Bharat Metals,Stainless Steel Suppliers in Avadi,"Stainless steel suppliers for Avadi. Bharat Metals Chennai supports enquiries for Pipes, Sheets, Plates, Rods, Bars and grades such as SS 304, SS 316, SS 202.",902,6,real image,yes,no,no,no,yes,yes,0,
stainless-steel-suppliers-avinashi/index.html,/stainless-steel-suppliers-avinashi/,city,Stainless Steel Suppliers in Avinashi | Bharat Metals,Stainless Steel Suppliers in Avinashi,"Stainless steel suppliers for Avinashi. Bharat Metals Chennai supports enquiries for Pipes, Sheets, Plates, Rods, Bars and grades such as SS 304, SS 316, SS 202.",902,6,real image,yes,no,no,no,yes,yes,0,
stainless-steel-suppliers-ballari/index.html,/stainless-steel-suppliers-ballari/,city,Stainless Steel Suppliers in Ballari | Bharat Metals,Stainless Steel Suppliers in Ballari,"Stainless steel suppliers for Ballari. Bharat Metals Chennai supports enquiries for Pipes, Sheets, Plates, Rods, Bars and grades such as SS 304, SS 316, SS 202.",891,6,real image,yes,no,no,no,yes,yes,0,
stainless-steel-suppliers-belagavi/index.html,/stainless-steel-suppliers-belagavi/,city,Stainless Steel Suppliers in Belagavi | Bharat Metals,Stainless Steel Suppliers in Belagavi,"Stainless steel suppliers for Belagavi. Bharat Metals Chennai supports enquiries for Pipes, Sheets, Plates, Rods, Bars and grades such as SS 304, SS 316, SS 202.",891,6,real image,yes,yes,no,no,yes,yes,0,
stainless-steel-suppliers-bengaluru/index.html,/stainless-steel-suppliers-bengaluru/,city,Stainless Steel Suppliers in Bengaluru | Bharat Metals,Stainless Steel Suppliers in Bengaluru,"Stainless steel suppliers for Bengaluru. Bharat Metals Chennai supports enquiries for Pipes, Sheets, Plates, Rods, Bars and grades such as SS 304, SS 316, SS 202.",891,6,real image,yes,yes,no,no,yes,yes,0,
stainless-steel-suppliers-bhavani/index.html,/stainless-steel-suppliers-bhavani/,city,Stainless Steel Suppliers in Bhavani | Bharat Metals,Stainless Steel Suppliers in Bhavani,"Stainless steel suppliers for Bhavani. Bharat Metals Chennai supports enquiries for Pipes, Sheets, Plates, Rods, Bars and grades such as SS 304, SS 316, SS 202.",902,6,real image,yes,no,no,no,yes,yes,0,
stainless-steel-suppliers-chengalpattu/index.html,/stainless-steel-suppliers-chengalpattu/,city,Stainless Steel Suppliers in Chengalpattu | Bharat Metals,Stainless Steel Suppliers in Chengalpattu,"Stainless steel suppliers for Chengalpattu. Bharat Metals Chennai supports enquiries for Pipes, Sheets, Plates, Rods, Bars and grades such as SS 304, SS 316, SS 202.",902,6,real image,yes,no,no,no,yes,yes,0,
stainless-steel-suppliers-chennai/index.html,/stainless-steel-suppliers-chennai/,city,Stainless Steel Suppliers in Chennai | Bharat Metals,Stainless Steel Suppliers in Chennai,"Stainless steel suppliers for Chennai. Bharat Metals Chennai supports enquiries for Pipes, Sheets, Plates, Coils, Rods and grades such as SS 304, SS 316, SS 202.",927,6,real image,yes,yes,no,yes,yes,yes,0,
stainless-steel-suppliers-chidambaram/index.html,/stainless-steel-suppliers-chidambaram/,city,Stainless Steel Suppliers in Chidambaram | Bharat Metals,Stainless Steel Suppliers in Chidambaram,"Stainless steel suppliers for Chidambaram. Bharat Metals Chennai supports enquiries for Pipes, Sheets, Plates, Rods, Bars and grades such as SS 304, SS 316, SS 202.",902,6,real image,yes,no,no,no,yes,yes,0,
stainless-steel-suppliers-chittoor/index.html,/stainless-steel-suppliers-chittoor/,city,Stainless Steel Suppliers in Chittoor | Bharat Metals,Stainless Steel Suppliers in Chittoor,"Stainless steel suppliers for Chittoor. Bharat Metals Chennai supports enquiries for Pipes, Sheets, Plates, Rods, Bars and grades such as SS 304, SS 316, SS 202.",895,6,real image,yes,yes,no,no,yes,yes,0,
stainless-steel-suppliers-coimbatore/index.html,/stainless-steel-suppliers-coimbatore/,city,Stainless Steel Suppliers in Coimbatore | Bharat Metals,Stainless Steel Suppliers in Coimbatore,"Stainless steel suppliers for Coimbatore. Bharat Metals Chennai supports enquiries for Rods, Bars, Flats, Plates, Sheets and grades such as SS 304, SS 316, SS 410.",881,6,real image,yes,yes,no,yes,yes,yes,0,
stainless-steel-suppliers-colombo/index.html,/stainless-steel-suppliers-colombo/,city,Stainless Steel Suppliers in Colombo | Bharat Metals,Stainless Steel Suppliers in Colombo,"Stainless steel suppliers for Colombo. Bharat Metals Chennai supports enquiries for Pipes, Sheets, Plates, Fasteners, Fittings and grades such as SS 304, SS 316, SS 316L.",881,6,real image,yes,no,no,no,yes,yes,0,
stainless-steel-suppliers-cuddalore-pondicherry-belt/index.html,/stainless-steel-suppliers-cuddalore-pondicherry-belt/,city,Stainless Steel Suppliers in Cuddalore Pondicherry Belt | Bharat Metals,Stainless Steel Suppliers in Cuddalore Pondicherry Belt,"Stainless steel suppliers for Cuddalore Pondicherry Belt. Bharat Metals Chennai supports enquiries for Pipes, Sheets, Plates, Rods, Bars and grades such as SS 304, SS 316, SS 202.",966,6,real image,yes,no,no,no,yes,yes,0,
stainless-steel-suppliers-cuddalore/index.html,/stainless-steel-suppliers-cuddalore/,city,Stainless Steel Suppliers in Cuddalore | Bharat Metals,Stainless Steel Suppliers in Cuddalore,"Stainless steel suppliers for Cuddalore. Bharat Metals Chennai supports enquiries for Pipes, Plates, Fittings, Flanges and grades such as SS 304, SS 316, SS 316L.",887,6,real image,yes,yes,no,no,yes,yes,0,
stainless-steel-suppliers-davangere/index.html,/stainless-steel-suppliers-davangere/,city,Stainless Steel Suppliers in Davangere | Bharat Metals,Stainless Steel Suppliers in Davangere,"Stainless steel suppliers for Davangere. Bharat Metals Chennai supports enquiries for Pipes, Sheets, Plates, Rods, Bars and grades such as SS 304, SS 316, SS 202.",891,6,real image,yes,no,no,no,yes,yes,0,
stainless-steel-suppliers-dharmapuri/index.html,/stainless-steel-suppliers-dharmapuri/,city,Stainless Steel Suppliers in Dharmapuri | Bharat Metals,Stainless Steel Suppliers in Dharmapuri,"Stainless steel suppliers for Dharmapuri. Bharat Metals Chennai supports enquiries for Pipes, Sheets, Plates, Rods, Bars and grades such as SS 304, SS 316, SS 202.",902,6,real image,yes,no,no,no,yes,yes,0,
stainless-steel-suppliers-dindigul/index.html,/stainless-steel-suppliers-dindigul/,city,Stainless Steel Suppliers in Dindigul | Bharat Metals,Stainless Steel Suppliers in Dindigul,"Stainless steel suppliers for Dindigul. Bharat Metals Chennai supports enquiries for Pipes, Sheets, Plates, Rods, Bars and grades such as SS 304, SS 316, SS 202.",902,6,real image,yes,no,no,no,yes,yes,0,
stainless-steel-suppliers-ennore/index.html,/stainless-steel-suppliers-ennore/,city,Stainless Steel Suppliers in Ennore | Bharat Metals,Stainless Steel Suppliers in Ennore,"Stainless steel suppliers for Ennore. Bharat Metals Chennai supports enquiries for Pipes, Sheets, Plates, Fasteners, Fittings and grades such as SS 304, SS 316, SS 316L.",902,6,real image,yes,no,no,no,yes,yes,0,
stainless-steel-suppliers-ernakulam/index.html,/stainless-steel-suppliers-ernakulam/,city,Stainless Steel Suppliers in Ernakulam | Bharat Metals,Stainless Steel Suppliers in Ernakulam,"Stainless steel suppliers for Ernakulam. Bharat Metals Chennai supports enquiries for Pipes, Sheets, Plates, Rods, Bars and grades such as SS 304, SS 316, SS 202.",891,6,real image,yes,yes,no,no,yes,yes,0,
stainless-steel-suppliers-erode/index.html,/stainless-steel-suppliers-erode/,city,Stainless Steel Suppliers in Erode | Bharat Metals,Stainless Steel Suppliers in Erode,"Stainless steel suppliers for Erode. Bharat Metals Chennai supports enquiries for Pipes, Sheets, Plates, Coils and grades such as SS 304, SS 316.",891,6,real image,yes,yes,no,no,yes,yes,0,
stainless-steel-suppliers-george-town-chennai/index.html,/stainless-steel-suppliers-george-town-chennai/,city,Stainless Steel Suppliers in George Town Chennai | Bharat Metals,Stainless Steel Suppliers in George Town Chennai,"Stainless steel suppliers for George Town Chennai. Bharat Metals Chennai supports enquiries for Pipes, Sheets, Plates, Rods, Bars and grades such as SS 304, SS 316, SS 202.",964,6,real image,yes,no,no,no,yes,yes,0,
stainless-steel-suppliers-gudur/index.html,/stainless-steel-suppliers-gudur/,city,Stainless Steel Suppliers in Gudur | Bharat Metals,Stainless Steel Suppliers in Gudur,"Stainless steel suppliers for Gudur. Bharat Metals Chennai supports enquiries for Pipes, Sheets, Plates, Rods, Bars and grades such as SS 304, SS 316, SS 202.",895,6,real image,yes,no,no,no,yes,yes,0,
stainless-steel-suppliers-guindy/index.html,/stainless-steel-suppliers-guindy/,city,Stainless Steel Suppliers in Guindy | Bharat Metals,Stainless Steel Suppliers in Guindy,"Stainless steel suppliers for Guindy. Bharat Metals Chennai supports enquiries for Sheets, Pipes, Rods, Fasteners and grades such as SS 304, SS 316.",892,6,real image,yes,yes,no,no,yes,yes,0,
stainless-steel-suppliers-gummidipoondi/index.html,/stainless-steel-suppliers-gummidipoondi/,city,Stainless Steel Suppliers in Gummidipoondi | Bharat Metals,Stainless Steel Suppliers in Gummidipoondi,"Stainless steel suppliers for Gummidipoondi. Bharat Metals Chennai supports enquiries for Pipes, Sheets, Plates, Rods, Bars and grades such as SS 304, SS 316, SS 202.",902,6,real image,yes,no,no,no,yes,yes,0,
stainless-steel-suppliers-hassan/index.html,/stainless-steel-suppliers-hassan/,city,Stainless Steel Suppliers in Hassan | Bharat Metals,Stainless Steel Suppliers in Hassan,"Stainless steel suppliers for Hassan. Bharat Metals Chennai supports enquiries for Pipes, Sheets, Plates, Rods, Bars and grades such as SS 304, SS 316, SS 202.",891,6,real image,yes,no,no,no,yes,yes,0,
stainless-steel-suppliers-hosur/index.html,/stainless-steel-suppliers-hosur/,city,Stainless Steel Suppliers in Hosur | Bharat Metals,Stainless Steel Suppliers in Hosur,"Stainless steel suppliers for Hosur. Bharat Metals Chennai supports enquiries for Rods, Bars, Sheets, Pipes, Plates and grades such as SS 304, SS 316, SS 202.",863,6,real image,yes,yes,no,yes,yes,yes,0,
stainless-steel-suppliers-hubballi/index.html,/stainless-steel-suppliers-hubballi/,city,Stainless Steel Suppliers in Hubballi | Bharat Metals,Stainless Steel Suppliers in Hubballi,"Stainless steel suppliers for Hubballi. Bharat Metals Chennai supports enquiries for Pipes, Sheets, Plates, Rods, Bars and grades such as SS 304, SS 316, SS 202.",891,6,real image,yes,yes,no,no,yes,yes,0,
stainless-steel-suppliers-irungattukottai/index.html,/stainless-steel-suppliers-irungattukottai/,city,Stainless Steel Suppliers in Irungattukottai | Bharat Metals,Stainless Steel Suppliers in Irungattukottai,"Stainless steel suppliers for Irungattukottai. Bharat Metals Chennai supports enquiries for Rods, Bars, Pipes, Fasteners and grades such as SS 304, SS 316.",890,6,real image,yes,no,no,no,yes,yes,0,
stainless-steel-suppliers-kadapa/index.html,/stainless-steel-suppliers-kadapa/,city,Stainless Steel Suppliers in Kadapa | Bharat Metals,Stainless Steel Suppliers in Kadapa,"Stainless steel suppliers for Kadapa. Bharat Metals Chennai supports enquiries for Pipes, Sheets, Plates, Rods, Bars and grades such as SS 304, SS 316, SS 202.",895,6,real image,yes,no,no,no,yes,yes,0,
stainless-steel-suppliers-kanchipuram/index.html,/stainless-steel-suppliers-kanchipuram/,city,Stainless Steel Suppliers in Kanchipuram | Bharat Metals,Stainless Steel Suppliers in Kanchipuram,"Stainless steel suppliers for Kanchipuram. Bharat Metals Chennai supports enquiries for Pipes, Sheets, Plates, Rods, Bars and grades such as SS 304, SS 316, SS 202.",902,6,real image,yes,yes,no,no,yes,yes,0,
stainless-steel-suppliers-kannur/index.html,/stainless-steel-suppliers-kannur/,city,Stainless Steel Suppliers in Kannur | Bharat Metals,Stainless Steel Suppliers in Kannur,"Stainless steel suppliers for Kannur. Bharat Metals Chennai supports enquiries for Pipes, Sheets, Plates, Fasteners, Fittings and grades such as SS 304, SS 316, SS 316L.",891,6,real image,yes,no,no,no,yes,yes,0,
stainless-steel-suppliers-kanyakumari/index.html,/stainless-steel-suppliers-kanyakumari/,city,Stainless Steel Suppliers in Kanyakumari | Bharat Metals,Stainless Steel Suppliers in Kanyakumari,"Stainless steel suppliers for Kanyakumari. Bharat Metals Chennai supports enquiries for Pipes, Sheets, Plates, Fasteners, Fittings and grades such as SS 304, SS 316, SS 316L.",902,6,real image,yes,no,no,no,yes,yes,0,
stainless-steel-suppliers-karaikal/index.html,/stainless-steel-suppliers-karaikal/,city,Stainless Steel Suppliers in Karaikal | Bharat Metals,Stainless Steel Suppliers in Karaikal,"Stainless steel suppliers for Karaikal. Bharat Metals Chennai supports enquiries for Pipes, Sheets, Plates, Fasteners, Fittings and grades such as SS 304, SS 316, SS 316L.",902,6,real image,yes,no,no,no,yes,yes,0,
stainless-steel-suppliers-karaikudi/index.html,/stainless-steel-suppliers-karaikudi/,city,Stainless Steel Suppliers in Karaikudi | Bharat Metals,Stainless Steel Suppliers in Karaikudi,"Stainless steel suppliers for Karaikudi. Bharat Metals Chennai supports enquiries for Pipes, Sheets, Plates, Rods, Bars and grades such as SS 304, SS 316, SS 202.",902,6,real image,yes,no,no,no,yes,yes,0,
stainless-steel-suppliers-karur/index.html,/stainless-steel-suppliers-karur/,city,Stainless Steel Suppliers in Karur | Bharat Metals,Stainless Steel Suppliers in Karur,"Stainless steel suppliers for Karur. Bharat Metals Chennai supports enquiries for Pipes, Sheets, Plates, Rods, Bars and grades such as SS 304, SS 316, SS 202.",902,6,real image,yes,yes,no,no,yes,yes,0,
stainless-steel-suppliers-katpadi/index.html,/stainless-steel-suppliers-katpadi/,city,Stainless Steel Suppliers in Katpadi | Bharat Metals,Stainless Steel Suppliers in Katpadi,"Stainless steel suppliers for Katpadi. Bharat Metals Chennai supports enquiries for Pipes, Sheets, Plates, Rods, Bars and grades such as SS 304, SS 316, SS 202.",902,6,real image,yes,no,no,no,yes,yes,0,
stainless-steel-suppliers-kochi/index.html,/stainless-steel-suppliers-kochi/,city,Stainless Steel Suppliers in Kochi | Bharat Metals,Stainless Steel Suppliers in Kochi,"Stainless steel suppliers for Kochi. Bharat Metals Chennai supports enquiries for Pipes, Sheets, Plates, Fasteners, Fittings and grades such as SS 304, SS 316, SS 316L.",891,6,real image,yes,yes,no,no,yes,yes,0,
stainless-steel-suppliers-kolar/index.html,/stainless-steel-suppliers-kolar/,city,Stainless Steel Suppliers in Kolar | Bharat Metals,Stainless Steel Suppliers in Kolar,"Stainless steel suppliers for Kolar. Bharat Metals Chennai supports enquiries for Pipes, Sheets, Plates, Rods, Bars and grades such as SS 304, SS 316, SS 202.",891,6,real image,yes,no,no,no,yes,yes,0,
stainless-steel-suppliers-kollam/index.html,/stainless-steel-suppliers-kollam/,city,Stainless Steel Suppliers in Kollam | Bharat Metals,Stainless Steel Suppliers in Kollam,"Stainless steel suppliers for Kollam. Bharat Metals Chennai supports enquiries for Pipes, Sheets, Plates, Fasteners, Fittings and grades such as SS 304, SS 316, SS 316L.",891,6,real image,yes,no,no,no,yes,yes,0,
stainless-steel-suppliers-kottayam/index.html,/stainless-steel-suppliers-kottayam/,city,Stainless Steel Suppliers in Kottayam | Bharat Metals,Stainless Steel Suppliers in Kottayam,"Stainless steel suppliers for Kottayam. Bharat Metals Chennai supports enquiries for Pipes, Sheets, Plates, Rods, Bars and grades such as SS 304, SS 316, SS 202.",891,6,real image,yes,no,no,no,yes,yes,0,
stainless-steel-suppliers-kozhikode/index.html,/stainless-steel-suppliers-kozhikode/,city,Stainless Steel Suppliers in Kozhikode | Bharat Metals,Stainless Steel Suppliers in Kozhikode,"Stainless steel suppliers for Kozhikode. Bharat Metals Chennai supports enquiries for Pipes, Sheets, Plates, Fasteners, Fittings and grades such as SS 304, SS 316, SS 316L.",891,6,real image,yes,yes,no,no,yes,yes,0,
stainless-steel-suppliers-krishnagiri/index.html,/stainless-steel-suppliers-krishnagiri/,city,Stainless Steel Suppliers in Krishnagiri | Bharat Metals,Stainless Steel Suppliers in Krishnagiri,"Stainless steel suppliers for Krishnagiri. Bharat Metals Chennai supports enquiries for Pipes, Sheets, Plates, Rods, Bars and grades such as SS 304, SS 316, SS 202.",902,6,real image,yes,no,no,no,yes,yes,0,
stainless-steel-suppliers-kumbakonam/index.html,/stainless-steel-suppliers-kumbakonam/,city,Stainless Steel Suppliers in Kumbakonam | Bharat Metals,Stainless Steel Suppliers in Kumbakonam,"Stainless steel suppliers for Kumbakonam. Bharat Metals Chennai supports enquiries for Pipes, Sheets, Plates, Rods, Bars and grades such as SS 304, SS 316, SS 202.",902,6,real image,yes,no,no,no,yes,yes,0,
stainless-steel-suppliers-madurai/index.html,/stainless-steel-suppliers-madurai/,city,Stainless Steel Suppliers in Madurai | Bharat Metals,Stainless Steel Suppliers in Madurai,"Stainless steel suppliers for Madurai. Bharat Metals Chennai supports enquiries for Sheets, Pipes, Rods, Decorative Stainless Steel and grades such as SS 304, SS 316, SS 202.",862,6,real image,yes,yes,no,yes,yes,yes,0,
stainless-steel-suppliers-mahabalipuram/index.html,/stainless-steel-suppliers-mahabalipuram/,city,Stainless Steel Suppliers in Mahabalipuram | Bharat Metals,Stainless Steel Suppliers in Mahabalipuram,"Stainless steel suppliers for Mahabalipuram. Bharat Metals Chennai supports enquiries for Pipes, Sheets, Plates, Fasteners, Fittings and grades such as SS 304, SS 316, SS 316L.",902,6,real image,yes,no,no,no,yes,yes,0,
stainless-steel-suppliers-malappuram/index.html,/stainless-steel-suppliers-malappuram/,city,Stainless Steel Suppliers in Malappuram | Bharat Metals,Stainless Steel Suppliers in Malappuram,"Stainless steel suppliers for Malappuram. Bharat Metals Chennai supports enquiries for Pipes, Sheets, Plates, Rods, Bars and grades such as SS 304, SS 316, SS 202.",891,6,real image,yes,no,no,no,yes,yes,0,
stainless-steel-suppliers-maldives/index.html,/stainless-steel-suppliers-maldives/,city,Stainless Steel Suppliers in Maldives | Bharat Metals,Stainless Steel Suppliers in Maldives,"Stainless steel suppliers for Maldives. Bharat Metals Chennai supports enquiries for Pipes, Sheets, Plates, Fasteners and grades such as SS 304, SS 316.",851,6,real image,yes,yes,no,no,yes,yes,0,Conservative nearby export enquiry wording used; no exporter alias created.
stainless-steel-suppliers-male/index.html,/stainless-steel-suppliers-male/,city,Stainless Steel Suppliers in Male | Bharat Metals,Stainless Steel Suppliers in Male,"Stainless steel suppliers for Male. Bharat Metals Chennai supports enquiries for Pipes, Sheets, Plates, Fasteners, Fittings and grades such as SS 304, SS 316, SS 316L.",881,6,real image,yes,no,no,no,yes,yes,0,
stainless-steel-suppliers-manali/index.html,/stainless-steel-suppliers-manali/,city,Stainless Steel Suppliers in Manali | Bharat Metals,Stainless Steel Suppliers in Manali,"Stainless steel suppliers for Manali. Bharat Metals Chennai supports enquiries for Pipes, Sheets, Plates, Rods, Bars and grades such as SS 304, SS 316, SS 202.",902,6,real image,yes,no,no,no,yes,yes,0,
stainless-steel-suppliers-mangalore/index.html,/stainless-steel-suppliers-mangalore/,city,Stainless Steel Suppliers in Mangalore | Bharat Metals,Stainless Steel Suppliers in Mangalore,"Stainless steel suppliers for Mangalore. Bharat Metals Chennai supports enquiries for Pipes, Sheets, Plates, Fasteners, Fittings and grades such as SS 304, SS 316, SS 316L.",891,6,real image,yes,yes,no,no,yes,yes,0,
stainless-steel-suppliers-maraimalai-nagar/index.html,/stainless-steel-suppliers-maraimalai-nagar/,city,Stainless Steel Suppliers in Maraimalai Nagar | Bharat Metals,Stainless Steel Suppliers in Maraimalai Nagar,"Stainless steel suppliers for Maraimalai Nagar. Bharat Metals Chennai supports enquiries for Pipes, Sheets, Plates, Rods, Bars and grades such as SS 304, SS 316, SS 202.",934,6,real image,yes,no,no,no,yes,yes,0,
stainless-steel-suppliers-mayiladuthurai/index.html,/stainless-steel-suppliers-mayiladuthurai/,city,Stainless Steel Suppliers in Mayiladuthurai | Bharat Metals,Stainless Steel Suppliers in Mayiladuthurai,"Stainless steel suppliers for Mayiladuthurai. Bharat Metals Chennai supports enquiries for Pipes, Sheets, Plates, Rods, Bars and grades such as SS 304, SS 316, SS 202.",902,6,real image,yes,no,no,no,yes,yes,0,
stainless-steel-suppliers-mettupalayam/index.html,/stainless-steel-suppliers-mettupalayam/,city,Stainless Steel Suppliers in Mettupalayam | Bharat Metals,Stainless Steel Suppliers in Mettupalayam,"Stainless steel suppliers for Mettupalayam. Bharat Metals Chennai supports enquiries for Pipes, Sheets, Plates, Rods, Bars and grades such as SS 304, SS 316, SS 202.",902,6,real image,yes,no,no,no,yes,yes,0,
stainless-steel-suppliers-mookernallamuthu-street-chennai/index.html,/stainless-steel-suppliers-mookernallamuthu-street-chennai/,city,Stainless Steel Suppliers in Mookernallamuthu Street Chennai | Bharat Metals,Stainless Steel Suppliers in Mookernallamuthu Street Chennai,"Stainless steel suppliers for Mookernallamuthu Street Chennai. Bharat Metals Chennai supports enquiries for Pipes, Sheets, Plates, Rods, Bars and grades such as SS 304, SS 316, SS 202.",964,6,real image,yes,no,no,no,yes,yes,0,
stainless-steel-suppliers-mysuru/index.html,/stainless-steel-suppliers-mysuru/,city,Stainless Steel Suppliers in Mysuru | Bharat Metals,Stainless Steel Suppliers in Mysuru,"Stainless steel suppliers for Mysuru. Bharat Metals Chennai supports enquiries for Pipes, Sheets, Plates, Rods, Bars and grades such as SS 304, SS 316, SS 202.",891,6,real image,yes,yes,no,no,yes,yes,0,
stainless-steel-suppliers-nagapattinam/index.html,/stainless-steel-suppliers-nagapattinam/,city,Stainless Steel Suppliers in Nagapattinam | Bharat Metals,Stainless Steel Suppliers in Nagapattinam,"Stainless steel suppliers for Nagapattinam. Bharat Metals Chennai supports enquiries for Pipes, Sheets, Plates, Fasteners, Fittings and grades such as SS 304, SS 316, SS 316L.",902,6,real image,yes,no,no,no,yes,yes,0,
stainless-steel-suppliers-nagercoil/index.html,/stainless-steel-suppliers-nagercoil/,city,Stainless Steel Suppliers in Nagercoil | Bharat Metals,Stainless Steel Suppliers in Nagercoil,"Stainless steel suppliers for Nagercoil. Bharat Metals Chennai supports enquiries for Pipes, Sheets, Plates, Rods, Bars and grades such as SS 304, SS 316, SS 202.",902,6,real image,yes,no,no,no,yes,yes,0,
