File path,Live URL path,Page type,Title,H1,Meta description,Word count,FAQ count,Image status,In sitemap,Linked from homepage,Linked from header,Linked from footer,Linked from parent hub page,Reachable from homepage within 3 clicks,Broken internal links,Notes
about-us/index.html,/about-us/,core,About Bharat Metals | Stainless Steel Dealers in Chennai,About Bharat Metals,"About Bharat Metals, a Chennai stainless steel dealer, stockist, supplier and wholesaler established in 1986.",698,6,real image,yes,yes,yes,no,yes,yes,0,
aluminium-bars/index.html,/aluminium-bars/,secondary material,Aluminium Bars in Chennai | Bharat Metals,Aluminium Bars Suppliers in Chennai,"Aluminium bars suppliers in Chennai for commercial, fabrication, engineering and trading enquiries.",550,5,real image,yes,yes,yes,no,yes,yes,0,
aluminium-coils/index.html,/aluminium-coils/,secondary material,Aluminium Coils in Chennai | Bharat Metals,Aluminium Coils Suppliers in Chennai,"Aluminium coils suppliers in Chennai for commercial, fabrication, engineering and trading enquiries.",550,5,real image,yes,yes,yes,no,yes,yes,0,
aluminium-flats/index.html,/aluminium-flats/,secondary material,Aluminium Flats in Chennai | Bharat Metals,Aluminium Flats Suppliers in Chennai,"Aluminium flats suppliers in Chennai for commercial, fabrication, engineering and trading enquiries.",550,5,real image,yes,yes,yes,no,yes,yes,0,
aluminium-pipes/index.html,/aluminium-pipes/,secondary material,Aluminium Pipes in Chennai | Bharat Metals,Aluminium Pipes Suppliers in Chennai,"Aluminium pipes suppliers in Chennai for commercial, fabrication, engineering and trading enquiries.",550,5,real image,yes,yes,yes,no,yes,yes,0,
aluminium-plates/index.html,/aluminium-plates/,secondary material,Aluminium Plates in Chennai | Bharat Metals,Aluminium Plates Suppliers in Chennai,"Aluminium plates suppliers in Chennai for commercial, fabrication, engineering and trading enquiries.",550,5,real image,yes,yes,yes,no,yes,yes,0,
aluminium-rods/index.html,/aluminium-rods/,secondary material,Aluminium Rods in Chennai | Bharat Metals,Aluminium Rods Suppliers in Chennai,"Aluminium rods suppliers in Chennai for commercial, fabrication, engineering and trading enquiries.",550,5,real image,yes,yes,yes,no,yes,yes,0,
aluminium-sheets/index.html,/aluminium-sheets/,secondary material,Aluminium Sheets in Chennai | Bharat Metals,Aluminium Sheets Suppliers in Chennai,"Aluminium sheets suppliers in Chennai for commercial, fabrication, engineering and trading enquiries.",550,5,real image,yes,yes,yes,no,yes,yes,0,
aluminium/index.html,/aluminium/,secondary material,Aluminium Suppliers in Chennai | Bharat Metals,Aluminium Suppliers in Chennai,"Aluminium suppliers in Chennai for commercial aluminium sheets, plates, coils, pipes, flats, rods, bars enquiries through Bharat Metals.",689,6,real image,yes,yes,yes,no,yes,yes,0,
blog/how-to-send-stainless-steel-rfq/index.html,/blog/how-to-send-stainless-steel-rfq/,blog,What Details to Send for a Fast Stainless Steel Quote | Bharat Metals Blog,What Details to Send for a Fast Stainless Steel Quote,"A simple RFQ checklist for product, grade, size, finish, quantity and delivery location.",1035,4,real image,yes,no,no,no,yes,yes,0,
blog/index.html,/blog/,core,Bharat Metals Blog | Stainless Steel Buyer Guides,Bharat Metals Blog,"Buyer guides for stainless steel grades, product forms, finishes, certificates and city supply support.",816,6,real image,yes,yes,yes,yes,yes,yes,0,
blog/polished-stainless-steel-pipes-chennai/index.html,/blog/polished-stainless-steel-pipes-chennai/,blog,Polished Stainless Steel Pipes in Chennai: Buyer Checklist | Bharat Metals Blog,Polished Stainless Steel Pipes in Chennai: Buyer Checklist,"Checklist for polished pipe enquiries for railings, interiors and decorative work.",1017,4,real image,yes,no,no,no,yes,yes,0,
blog/ss-202-vs-ss-304-railing-work/index.html,/blog/ss-202-vs-ss-304-railing-work/,blog,SS 202 vs SS 304 for Railing and Fabrication Work | Bharat Metals Blog,SS 202 vs SS 304 for Railing and Fabrication Work,A practical buyer note for railing contractors comparing SS 202 and SS 304.,1026,4,real image,yes,no,no,no,yes,yes,0,
blog/ss-304-vs-ss-316/index.html,/blog/ss-304-vs-ss-316/,blog,SS 304 vs SS 316: Which Grade Should Fabricators Choose? | Bharat Metals Blog,SS 304 vs SS 316: Which Grade Should Fabricators Choose?,"Compare SS 304 and SS 316 for corrosion exposure, fabrication, coastal use and RFQ clarity.",1031,4,real image,yes,no,no,no,yes,yes,0,
blog/stainless-steel-for-automobile-industries-tamil-nadu/index.html,/blog/stainless-steel-for-automobile-industries-tamil-nadu/,blog,Stainless Steel for Automobile and Auto Component Industries in Tamil Nadu | Bharat Metals Blog,Stainless Steel for Automobile and Auto Component Industries in Tamil Nadu,Common stainless steel forms for automotive and component buyers.,1022,4,real image,yes,no,no,no,yes,yes,0,
blog/stainless-steel-for-coastal-and-marine-use/index.html,/blog/stainless-steel-for-coastal-and-marine-use/,blog,Stainless Steel for Coastal and Marine Use: 304 vs 316 Buying Notes | Bharat Metals Blog,Stainless Steel for Coastal and Marine Use: 304 vs 316 Buying Notes,"How to discuss 304 and 316 for marine, coastal and export-facing enquiries.",1031,4,real image,yes,no,no,no,yes,yes,0,
blog/stainless-steel-for-commercial-kitchens/index.html,/blog/stainless-steel-for-commercial-kitchens/,blog,Stainless Steel for Hotel and Commercial Kitchen Equipment | Bharat Metals Blog,Stainless Steel for Hotel and Commercial Kitchen Equipment,Material forms and finish notes for hotel and commercial kitchen equipment fabricators.,1013,4,real image,yes,no,no,no,yes,yes,0,
blog/stainless-steel-for-food-and-pharma/index.html,/blog/stainless-steel-for-food-and-pharma/,blog,Stainless Steel for Food Processing and Pharma Equipment | Bharat Metals Blog,Stainless Steel for Food Processing and Pharma Equipment,Common stainless steel requirements for food processing and pharma equipment buyers.,1018,4,real image,yes,no,no,no,yes,yes,0,
blog/stainless-steel-material-test-certificate/index.html,/blog/stainless-steel-material-test-certificate/,blog,MTC and Mill Certificate for Stainless Steel: What Buyers Should Know | Bharat Metals Blog,MTC and Mill Certificate for Stainless Steel: What Buyers Should Know,Practical notes on certificate requests for stainless steel buyers.,1026,4,real image,yes,no,no,no,yes,yes,0,
blog/stainless-steel-perforated-sheets-wire-mesh/index.html,/blog/stainless-steel-perforated-sheets-wire-mesh/,blog,Stainless Steel Perforated Sheets and Wire Mesh: Uses and Buying Tips | Bharat Metals Blog,Stainless Steel Perforated Sheets and Wire Mesh: Uses and Buying Tips,How to specify perforated sheets and wire mesh for industrial and architectural use.,1030,4,real image,yes,no,no,no,yes,yes,0,
blog/stainless-steel-pipes-welded-vs-seamless/index.html,/blog/stainless-steel-pipes-welded-vs-seamless/,blog,Stainless Steel Welded Pipe vs Seamless Pipe: Buyer Guide | Bharat Metals Blog,Stainless Steel Welded Pipe vs Seamless Pipe: Buyer Guide,Understand welded and seamless stainless steel pipe enquiries before asking for a quote.,1029,4,real image,yes,no,no,no,yes,yes,0,
blog/stainless-steel-plates-buyer-guide/index.html,/blog/stainless-steel-plates-buyer-guide/,blog,Stainless Steel Plates: Buyer Guide for Tamil Nadu Industries | Bharat Metals Blog,Stainless Steel Plates: Buyer Guide for Tamil Nadu Industries,"Plate enquiry notes for thickness, cutting, grade, certificate and application.",1021,4,real image,yes,no,no,no,yes,yes,0,
blog/stainless-steel-sheet-finishes/index.html,/blog/stainless-steel-sheet-finishes/,blog,"Stainless Steel Sheet Finishes: 2B, Mirror, Matt, Hairline and BA | Bharat Metals Blog","Stainless Steel Sheet Finishes: 2B, Mirror, Matt, Hairline and BA",How to describe finish requirements for stainless steel sheets in a quotation.,1046,4,real image,yes,no,no,no,yes,yes,0,
blog/stainless-steel-supply-tamil-nadu-cities/index.html,/blog/stainless-steel-supply-tamil-nadu-cities/,blog,"Stainless Steel Supply Across Tamil Nadu: Chennai to Coimbatore, Hosur and Trichy | Bharat Metals Blog","Stainless Steel Supply Across Tamil Nadu: Chennai to Coimbatore, Hosur and Trichy",How Chennai-based stainless steel supply supports enquiries across Tamil Nadu.,1031,4,real image,yes,no,no,no,yes,yes,0,
blog/stainless-steel-supply-to-sricity-tada-tirupati/index.html,/blog/stainless-steel-supply-to-sricity-tada-tirupati/,blog,"Stainless Steel Supply to Sricity, Tada and Tirupati: Buyer Guide | Bharat Metals Blog","Stainless Steel Supply to Sricity, Tada and Tirupati: Buyer Guide","Supply guidance from Chennai for buyers in Sricity, Tada, Renigunta and Tirupati.",1022,4,real image,yes,no,no,no,yes,yes,0,
brass-bars/index.html,/brass-bars/,secondary material,Brass Bars in Chennai | Bharat Metals,Brass Bars Suppliers in Chennai,"Brass bars suppliers in Chennai for commercial, fabrication, engineering and trading enquiries.",550,5,real image,yes,yes,yes,no,yes,yes,0,
brass-bush-pipes/index.html,/brass-bush-pipes/,secondary material,Brass Bush Pipes in Chennai | Bharat Metals,Brass Bush Pipes Suppliers in Chennai,"Brass bush pipes suppliers in Chennai for commercial, fabrication, engineering and trading enquiries.",563,5,real image,yes,yes,yes,no,yes,yes,0,
brass-flats/index.html,/brass-flats/,secondary material,Brass Flats in Chennai | Bharat Metals,Brass Flats Suppliers in Chennai,"Brass flats suppliers in Chennai for commercial, fabrication, engineering and trading enquiries.",550,5,real image,yes,yes,yes,no,yes,yes,0,
brass-pipes/index.html,/brass-pipes/,secondary material,Brass Pipes in Chennai | Bharat Metals,Brass Pipes Suppliers in Chennai,"Brass pipes suppliers in Chennai for commercial, fabrication, engineering and trading enquiries.",550,5,real image,yes,yes,yes,no,yes,yes,0,
brass-rods/index.html,/brass-rods/,secondary material,Brass Rods in Chennai | Bharat Metals,Brass Rods Suppliers in Chennai,"Brass rods suppliers in Chennai for commercial, fabrication, engineering and trading enquiries.",550,5,real image,yes,yes,yes,no,yes,yes,0,
brass/index.html,/brass/,secondary material,Brass Suppliers in Chennai | Bharat Metals,Brass Suppliers in Chennai,"Brass suppliers in Chennai for commercial brass pipes, bush pipes, rods, bars, flats enquiries through Bharat Metals.",666,6,real image,yes,yes,yes,no,yes,yes,0,
contact-us/index.html,/contact-us/,core,Contact Bharat Metals | Stainless Steel Dealers Chennai,Contact Bharat Metals,"Contact Bharat Metals in Chennai for stainless steel pipes, sheets, plates, rods, bars, flanges and fittings.",495,6,real image,yes,yes,yes,no,yes,yes,0,
contacts-us/index.html,/contacts-us/,core,Legacy Contact Bharat Metals | Bharat Metals,Legacy Contact Bharat Metals,Legacy contact URL for Bharat Metals stainless steel enquiries in Chennai.,514,6,real image,yes,no,no,no,no,yes,0,
copper-bars/index.html,/copper-bars/,secondary material,Copper Bars in Chennai | Bharat Metals,Copper Bars Suppliers in Chennai,"Copper bars suppliers in Chennai for commercial, fabrication, engineering and trading enquiries.",550,5,real image,yes,yes,yes,no,yes,yes,0,
copper-flats/index.html,/copper-flats/,secondary material,Copper Flats in Chennai | Bharat Metals,Copper Flats Suppliers in Chennai,"Copper flats suppliers in Chennai for commercial, fabrication, engineering and trading enquiries.",550,5,real image,yes,yes,yes,no,yes,yes,0,
copper-plates/index.html,/copper-plates/,secondary material,Copper Plates in Chennai | Bharat Metals,Copper Plates Suppliers in Chennai,"Copper plates suppliers in Chennai for commercial, fabrication, engineering and trading enquiries.",550,5,real image,yes,yes,yes,no,yes,yes,0,
copper-rods/index.html,/copper-rods/,secondary material,Copper Rods in Chennai | Bharat Metals,Copper Rods Suppliers in Chennai,"Copper rods suppliers in Chennai for commercial, fabrication, engineering and trading enquiries.",550,5,real image,yes,yes,yes,no,yes,yes,0,
copper-tubes/index.html,/copper-tubes/,secondary material,Copper Tubes in Chennai | Bharat Metals,Copper Tubes Suppliers in Chennai,"Copper tubes suppliers in Chennai for commercial, fabrication, engineering and trading enquiries.",550,5,real image,yes,yes,yes,no,yes,yes,0,
copper/index.html,/copper/,secondary material,Copper Suppliers in Chennai | Bharat Metals,Copper Suppliers in Chennai,"Copper suppliers in Chennai for commercial copper tubes, flats, rods, bars, plates enquiries through Bharat Metals.",661,6,real image,yes,yes,yes,no,yes,yes,0,
index.html,/,core,Stainless Steel Dealers in Chennai | Bharat Metals Since 1986,STAINLESS STEEL SUPPLIERS IN CHENNAI SINCE 1986,"Bharat Metals is a Chennai stainless steel stockist, supplier and wholesaler since 1986, serving SS pipes, sheets, plates, coils, rods and fittings across Tamil Nadu and nearby South India markets.",1776,10,real image,yes,no,no,no,no,yes,0,
industries-we-serve/index.html,/industries-we-serve/,core,Industries We Serve | Bharat Metals Stainless Steel Chennai,Industries We Serve,"Industries served by Bharat Metals for stainless steel supply in Chennai, Tamil Nadu and nearby South India.",972,6,real image,yes,yes,yes,no,yes,yes,0,
industries/automobile-auto-components/index.html,/industries/automobile-auto-components/,industry,Automobile and Auto Components Stainless Steel Suppliers | Bharat Metals,Stainless Steel for Automobile and Auto Components,"Stainless steel suppliers for Automobile and Auto Components: Rods, Bars, Sheets, Fasteners and grades such as SS 304, SS 316, SS 410.",1008,6,real image,yes,yes,no,no,yes,yes,0,
industries/boiler-heat-exchanger-fabricators/index.html,/industries/boiler-heat-exchanger-fabricators/,industry,Boiler and Heat Exchanger Fabricators Stainless Steel Suppliers | Bharat Metals,Stainless Steel for Boiler and Heat Exchanger Fabricators,"Stainless steel suppliers for Boiler and Heat Exchanger Fabricators: Tubes, Plates, Pipes, Flanges and grades such as SS 304, SS 316, SS 310.",1078,6,real image,yes,no,no,no,yes,yes,0,
industries/builders-construction/index.html,/industries/builders-construction/,industry,Builders and Construction Stainless Steel Suppliers | Bharat Metals,Stainless Steel for Builders and Construction,"Stainless steel suppliers for Builders and Construction: Angles, Channels, Sheets, Fasteners and grades such as SS 202, SS 304, SS 316.",1030,6,real image,yes,yes,no,no,yes,yes,0,
industries/chemical-petrochemical/index.html,/industries/chemical-petrochemical/,industry,Chemical and Petrochemical Stainless Steel Suppliers | Bharat Metals,Stainless Steel for Chemical and Petrochemical,"Stainless steel suppliers for Chemical and Petrochemical: Pipes, Fittings, Flanges, Plates and grades such as SS 304, SS 316, SS 316L.",1029,6,real image,yes,yes,no,no,yes,yes,0,
industries/commercial-kitchen-equipment/index.html,/industries/commercial-kitchen-equipment/,industry,Hotel and Commercial Kitchen Equipment Stainless Steel Suppliers | Bharat Metals,Stainless Steel for Hotel and Commercial Kitchen Equipment,"Stainless steel suppliers for Hotel and Commercial Kitchen Equipment: Sheets, Tubes, Pipes, Plates and grades such as SS 304, SS 316.",1073,6,real image,yes,yes,no,no,yes,yes,0,Maps requested hotel commercial kitchen industry example to existing slug.
industries/dairy-beverage-processing/index.html,/industries/dairy-beverage-processing/,industry,Dairy and Beverage Processing Stainless Steel Suppliers | Bharat Metals,Stainless Steel for Dairy and Beverage Processing,"Stainless steel suppliers for Dairy and Beverage Processing: Pipes, Tubes, Sheets, Fittings and grades such as SS 304, SS 316, SS 316L.",1053,6,real image,yes,no,no,no,yes,yes,0,
industries/electrical-control-panel-fabrication/index.html,/industries/electrical-control-panel-fabrication/,industry,Electrical and Control Panel Fabrication Stainless Steel Suppliers | Bharat Metals,Stainless Steel for Electrical and Control Panel Fabrication,"Stainless steel suppliers for Electrical and Control Panel Fabrication: Sheets, Angles, Fasteners, Channels and grades such as SS 304, SS 430.",1076,6,real image,yes,no,no,no,yes,yes,0,
industries/engineering-machine-shops/index.html,/industries/engineering-machine-shops/,industry,Engineering and Machine Shops Stainless Steel Suppliers | Bharat Metals,Stainless Steel for Engineering and Machine Shops,"Stainless steel suppliers for Engineering and Machine Shops: Bars, Rods, Plates, Flats and grades such as SS 304, SS 316, SS 410.",1055,6,real image,yes,yes,no,no,yes,yes,0,
industries/fabrication-welding/index.html,/industries/fabrication-welding/,industry,Fabrication and Welding Stainless Steel Suppliers | Bharat Metals,Stainless Steel for Fabrication and Welding,"Stainless steel suppliers for Fabrication and Welding: Pipes, Sheets, Rods, Angles and grades such as SS 202, SS 304, SS 316.",1029,6,real image,yes,yes,no,no,yes,yes,0,
industries/food-processing/index.html,/industries/food-processing/,industry,Food Processing Stainless Steel Suppliers | Bharat Metals,Stainless Steel for Food Processing,"Stainless steel suppliers for Food Processing: Sheets, Pipes, Fittings, Wire Mesh and grades such as SS 304, SS 316, SS 316L.",1016,6,real image,yes,yes,no,no,yes,yes,0,
industries/institutional-fabrication/index.html,/industries/institutional-fabrication/,industry,Educational and Institutional Fabrication Stainless Steel Suppliers | Bharat Metals,Stainless Steel for Educational and Institutional Fabrication,"Stainless steel suppliers for Educational and Institutional Fabrication: Sheets, Pipes, Tubes, Fasteners and grades such as SS 202, SS 304.",1049,6,real image,yes,no,no,no,yes,yes,0,
industries/interior-architectural-contractors/index.html,/industries/interior-architectural-contractors/,industry,Interior and Architectural Contractors Stainless Steel Suppliers | Bharat Metals,Stainless Steel for Interior and Architectural Contractors,"Stainless steel suppliers for Interior and Architectural Contractors: Sheets, Tubes, Flats, Decorative Stainless Steel and grades such as SS 304, SS 430.",1057,6,real image,yes,yes,no,no,yes,yes,0,
industries/marine-ship-repair/index.html,/industries/marine-ship-repair/,industry,Marine and Ship Repair Stainless Steel Suppliers | Bharat Metals,Stainless Steel for Marine and Ship Repair,"Stainless steel suppliers for Marine and Ship Repair: Pipes, Plates, Fasteners, Fittings and grades such as SS 316, SS 316L.",1050,6,real image,yes,yes,no,no,yes,yes,0,
industries/oil-gas/index.html,/industries/oil-gas/,industry,Oil and Gas Stainless Steel Suppliers | Bharat Metals,Stainless Steel for Oil and Gas,"Stainless steel suppliers for Oil and Gas: Pipes, Flanges, Fittings, Plates and grades such as SS 304, SS 316, SS 316L.",1029,6,real image,yes,yes,no,no,yes,yes,0,
industries/paper-mills/index.html,/industries/paper-mills/,industry,Paper Mills Stainless Steel Suppliers | Bharat Metals,Stainless Steel for Paper Mills,"Stainless steel suppliers for Paper Mills: Sheets, Plates, Pipes, Fittings and grades such as SS 304, SS 316.",1006,6,real image,yes,no,no,no,yes,yes,0,
industries/pharma-healthcare-equipment/index.html,/industries/pharma-healthcare-equipment/,industry,Pharma and Healthcare Equipment Stainless Steel Suppliers | Bharat Metals,Stainless Steel for Pharma and Healthcare Equipment,"Stainless steel suppliers for Pharma and Healthcare Equipment: Sheets, Tubes, Pipes, Fittings and grades such as SS 304, SS 316, SS 316L.",1053,6,real image,yes,yes,no,no,yes,yes,0,
industries/ports-shipping-coastal-infrastructure/index.html,/industries/ports-shipping-coastal-infrastructure/,industry,"Ports, Shipping and Coastal Infrastructure Stainless Steel Suppliers | Bharat Metals","Stainless Steel for Ports, Shipping and Coastal Infrastructure","Stainless steel suppliers for Ports, Shipping and Coastal Infrastructure: Pipes, Plates, Fasteners, Flanges and grades such as SS 316, SS 316L.",1075,6,real image,yes,no,no,no,yes,yes,0,
industries/public-works-infrastructure/index.html,/industries/public-works-infrastructure/,industry,Public Works and Infrastructure Contractors Stainless Steel Suppliers | Bharat Metals,Stainless Steel for Public Works and Infrastructure Contractors,"Stainless steel suppliers for Public Works and Infrastructure Contractors: Angles, Channels, Plates, Fasteners and grades such as SS 304, SS 316.",1076,6,real image,yes,no,no,no,yes,yes,0,
industries/pump-valve-equipment-manufacturers/index.html,/industries/pump-valve-equipment-manufacturers/,industry,"Pump, Valve and Equipment Manufacturers Stainless Steel Suppliers | Bharat Metals","Stainless Steel for Pump, Valve and Equipment Manufacturers","Stainless steel suppliers for Pump, Valve and Equipment Manufacturers: Bars, Rods, Flanges, Fittings and grades such as SS 304, SS 316, SS 410.",1081,6,real image,yes,no,no,no,yes,yes,0,
industries/railing-contractors/index.html,/industries/railing-contractors/,industry,Railing Contractors Stainless Steel Suppliers | Bharat Metals,Stainless Steel for Railing Contractors,"Stainless steel suppliers for Railing Contractors: Polished Pipes, Tubes, Flats, Sheets and grades such as SS 202, SS 304, SS 316.",1015,6,real image,yes,yes,no,no,yes,yes,0,
industries/railways-metro-projects/index.html,/industries/railways-metro-projects/,industry,Railways and Metro Projects Stainless Steel Suppliers | Bharat Metals,Stainless Steel for Railways and Metro Projects,"Stainless steel suppliers for Railways and Metro Projects: Sheets, Pipes, Fasteners, Plates and grades such as SS 304, SS 316.",1049,6,real image,yes,yes,no,no,yes,yes,0,
industries/sugar-mills-agro-processing/index.html,/industries/sugar-mills-agro-processing/,industry,Sugar Mills and Agro Processing Stainless Steel Suppliers | Bharat Metals,Stainless Steel for Sugar Mills and Agro Processing,"Stainless steel suppliers for Sugar Mills and Agro Processing: Plates, Sheets, Pipes, Wire Mesh and grades such as SS 304, SS 316.",1079,6,real image,yes,no,no,no,yes,yes,0,
industries/textile-dyeing-processing/index.html,/industries/textile-dyeing-processing/,industry,Textile Dyeing and Processing Units Stainless Steel Suppliers | Bharat Metals,Stainless Steel for Textile Dyeing and Processing Units,"Stainless steel suppliers for Textile Dyeing and Processing Units: Pipes, Sheets, Perforated Sheets, Fittings and grades such as SS 304, SS 316.",1078,6,real image,yes,no,no,no,yes,yes,0,
industries/textile-machinery/index.html,/industries/textile-machinery/,industry,Textile Machinery Stainless Steel Suppliers | Bharat Metals,Stainless Steel for Textile Machinery,"Stainless steel suppliers for Textile Machinery: Rods, Bars, Sheets, Flats and grades such as SS 304, SS 316.",1008,6,real image,yes,yes,no,no,yes,yes,0,
industries/water-treatment-utilities/index.html,/industries/water-treatment-utilities/,industry,Water Treatment and Utilities Stainless Steel Suppliers | Bharat Metals,Stainless Steel for Water Treatment and Utilities,"Stainless steel suppliers for Water Treatment and Utilities: Pipes, Fittings, Wire Mesh, Plates and grades such as SS 304, SS 316.",1055,6,real image,yes,yes,no,no,yes,yes,0,
locations-we-serve/index.html,/locations-we-serve/,core,Locations We Serve | Stainless Steel Suppliers Tamil Nadu,Locations We Serve,"Bharat Metals Chennai supports stainless steel enquiries across Tamil Nadu, nearby South India, Andaman and nearby export markets.",816,6,real image,yes,yes,yes,no,yes,yes,0,
mission-vision/index.html,/mission-vision/,core,Mission and Vision | Bharat Metals Chennai,Mission and Vision,Mission and vision of Bharat Metals for practical stainless steel supply support in Chennai and Tamil Nadu.,533,6,real image,yes,yes,yes,no,yes,yes,0,
products/index.html,/products/,core,Product Portfolio | Bharat Metals Chennai Stainless Steel Suppliers,Product Portfolio,"Browse Bharat Metals stainless steel product forms, grades, aluminium, brass, copper and popular stainless steel searches.",2230,6,real image,yes,no,no,no,yes,yes,0,
request-quote/index.html,/request-quote/,core,Request a Stainless Steel Quote | Bharat Metals Chennai,Request a Stainless Steel Quote,"Send product form, grade, size, finish, quantity and delivery location to Bharat Metals for a stainless steel quotation.",544,6,real image,yes,yes,yes,yes,yes,yes,0,
site-map/index.html,/site-map/,core,Sitemap | Bharat Metals,Sitemap,"Human-readable sitemap for Bharat Metals pages including products, grades, cities, industries, blog and technical pages.",3104,4,real image,yes,yes,yes,yes,yes,yes,0,
ss-202-angles/index.html,/ss-202-angles/,grade+form,SS 202 Angles Suppliers in Chennai | Bharat Metals,SS 202 Angles Suppliers in Chennai,"SS 202 Angles suppliers in Chennai with grade, size, finish, quantity, certificate and transport details.",866,5,real image,yes,no,no,no,yes,yes,0,
ss-202-bars/index.html,/ss-202-bars/,grade+form,SS 202 Bars Suppliers in Chennai | Bharat Metals,SS 202 Bars Suppliers in Chennai,"SS 202 Bars suppliers in Chennai with grade, size, finish, quantity, certificate and transport details.",922,5,real image,yes,no,no,no,yes,yes,0,
ss-202-channels/index.html,/ss-202-channels/,grade+form,SS 202 Channels Suppliers in Chennai | Bharat Metals,SS 202 Channels Suppliers in Chennai,"SS 202 Channels suppliers in Chennai with grade, size, finish, quantity, certificate and transport details.",868,5,real image,yes,no,no,no,yes,yes,0,
ss-202-circles/index.html,/ss-202-circles/,grade+form,SS 202 Circles Suppliers in Chennai | Bharat Metals,SS 202 Circles Suppliers in Chennai,"SS 202 Circles suppliers in Chennai with grade, size, finish, quantity, certificate and transport details.",885,5,real image,yes,no,no,no,yes,yes,0,
